[
  {
    "question_id": "QST-654382",
    "question_text": "What is a Consent Manager?",
    "audience": [
      "business"
    ],
    "topic": "Consent Manager",
    "dpdpa_section": null,
    "dpdp_rule": null,
    "asked_on_competitor": true,
    "competitor_urls": [
      "https://dpdpa.com/dpdpa-faq.html"
    ],
    "asked_on_saralprivacy": true,
    "saralprivacy_surfaces": [
      "MSME guide"
    ],
    "primary_citation": "DPDPA 2023 Section 2; Rules on registration",
    "gap": "both_ask",
    "publication_eligible": false
  },
  {
    "question_id": "QST-615630",
    "question_text": "What are the data breach notification requirements?",
    "audience": [
      "business"
    ],
    "topic": "Breach response",
    "dpdpa_section": null,
    "dpdp_rule": null,
    "asked_on_competitor": true,
    "competitor_urls": [
      "https://dpdpa.com/dpdpa-faq.html",
      "https://www.dpdpa.com/dpdpa-interview-questions.html"
    ],
    "asked_on_saralprivacy": false,
    "saralprivacy_surfaces": [],
    "primary_citation": "DPDPA 2023 Section 8(6); Rules on intimation",
    "gap": "they_ask_we_dont",
    "publication_eligible": false
  },
  {
    "question_id": "QST-294577",
    "question_text": "How does DPDPA define a \"child\"?",
    "audience": [
      "business"
    ],
    "topic": "Children",
    "dpdpa_section": null,
    "dpdp_rule": null,
    "asked_on_competitor": true,
    "competitor_urls": [
      "https://dpdpa.com/dpdpa-faq.html"
    ],
    "asked_on_saralprivacy": false,
    "saralprivacy_surfaces": [],
    "primary_citation": "DPDPA 2023 Section 9",
    "gap": "they_ask_we_dont",
    "publication_eligible": false
  },
  {
    "question_id": "QST-558600",
    "question_text": "How do you implement age verification for children under DPDPA?",
    "audience": [
      "student"
    ],
    "topic": "Children",
    "dpdpa_section": null,
    "dpdp_rule": null,
    "asked_on_competitor": true,
    "competitor_urls": [
      "https://www.dpdpa.com/dpdpa-interview-questions.html"
    ],
    "asked_on_saralprivacy": false,
    "saralprivacy_surfaces": [],
    "primary_citation": "DPDPA 2023 Section 9",
    "gap": "they_ask_we_dont",
    "publication_eligible": false
  },
  {
    "question_id": "QST-623568",
    "question_text": "What special protections exist for children's data under DPDPA?",
    "audience": [
      "student"
    ],
    "topic": "Children",
    "dpdpa_section": null,
    "dpdp_rule": null,
    "asked_on_competitor": true,
    "competitor_urls": [
      "https://www.dpdpa.com/dpdpa-interview-questions.html"
    ],
    "asked_on_saralprivacy": false,
    "saralprivacy_surfaces": [],
    "primary_citation": "DPDPA 2023 Section 9",
    "gap": "they_ask_we_dont",
    "publication_eligible": false
  },
  {
    "question_id": "QST-701686",
    "question_text": "What special protections exist for children's data?",
    "audience": [
      "business"
    ],
    "topic": "Children",
    "dpdpa_section": null,
    "dpdp_rule": null,
    "asked_on_competitor": true,
    "competitor_urls": [
      "https://dpdpa.com/dpdpa-faq.html"
    ],
    "asked_on_saralprivacy": false,
    "saralprivacy_surfaces": [],
    "primary_citation": "DPDPA 2023 Section 9",
    "gap": "they_ask_we_dont",
    "publication_eligible": false
  },
  {
    "question_id": "QST-954141",
    "question_text": "Are there exemptions for children's data processing?",
    "audience": [
      "business"
    ],
    "topic": "Children",
    "dpdpa_section": null,
    "dpdp_rule": null,
    "asked_on_competitor": true,
    "competitor_urls": [
      "https://dpdpa.com/dpdpa-faq.html"
    ],
    "asked_on_saralprivacy": false,
    "saralprivacy_surfaces": [],
    "primary_citation": "DPDPA 2023 Section 9",
    "gap": "they_ask_we_dont",
    "publication_eligible": false
  },
  {
    "question_id": "QST-013985",
    "question_text": "Can consent be withdrawn?",
    "audience": [
      "business"
    ],
    "topic": "Consent",
    "dpdpa_section": null,
    "dpdp_rule": null,
    "asked_on_competitor": true,
    "competitor_urls": [
      "https://dpdpa.com/dpdpa-faq.html"
    ],
    "asked_on_saralprivacy": false,
    "saralprivacy_surfaces": [],
    "primary_citation": "DPDPA 2023 Section 6",
    "gap": "they_ask_we_dont",
    "publication_eligible": false
  },
  {
    "question_id": "QST-203867",
    "question_text": "What are \"Legitimate Uses\" where consent is NOT required?",
    "audience": [
      "student"
    ],
    "topic": "Consent",
    "dpdpa_section": null,
    "dpdp_rule": null,
    "asked_on_competitor": true,
    "competitor_urls": [
      "https://www.dpdpa.com/dpdpa-interview-questions.html",
      "https://dpdpa.com/dpdpa-faq.html"
    ],
    "asked_on_saralprivacy": false,
    "saralprivacy_surfaces": [],
    "primary_citation": "DPDPA 2023 Section 6",
    "gap": "they_ask_we_dont",
    "publication_eligible": false
  },
  {
    "question_id": "QST-431475",
    "question_text": "How can a Data Principal withdraw consent?",
    "audience": [
      "student",
      "data principal"
    ],
    "topic": "Consent",
    "dpdpa_section": null,
    "dpdp_rule": null,
    "asked_on_competitor": true,
    "competitor_urls": [
      "https://www.dpdpa.com/dpdpa-interview-questions.html"
    ],
    "asked_on_saralprivacy": false,
    "saralprivacy_surfaces": [],
    "primary_citation": "DPDPA 2023 Section 6",
    "gap": "they_ask_we_dont",
    "publication_eligible": false
  },
  {
    "question_id": "QST-783848",
    "question_text": "What are the requirements for valid consent under DPDPA?",
    "audience": [
      "student"
    ],
    "topic": "Consent",
    "dpdpa_section": null,
    "dpdp_rule": null,
    "asked_on_competitor": true,
    "competitor_urls": [
      "https://www.dpdpa.com/dpdpa-interview-questions.html",
      "https://dpdpa.com/dpdpa-faq.html"
    ],
    "asked_on_saralprivacy": false,
    "saralprivacy_surfaces": [],
    "primary_citation": "DPDPA 2023 Section 6",
    "gap": "they_ask_we_dont",
    "publication_eligible": false
  },
  {
    "question_id": "QST-892001",
    "question_text": "What is a Consent Manager and how does it function?",
    "audience": [
      "student"
    ],
    "topic": "Consent Manager",
    "dpdpa_section": null,
    "dpdp_rule": null,
    "asked_on_competitor": true,
    "competitor_urls": [
      "https://www.dpdpa.com/dpdpa-interview-questions.html"
    ],
    "asked_on_saralprivacy": false,
    "saralprivacy_surfaces": [],
    "primary_citation": "DPDPA 2023 Section 2; Rules on registration",
    "gap": "they_ask_we_dont",
    "publication_eligible": false
  },
  {
    "question_id": "QST-383747",
    "question_text": "Can personal data be transferred outside India?",
    "audience": [
      "business"
    ],
    "topic": "Cross-border transfer",
    "dpdpa_section": null,
    "dpdp_rule": null,
    "asked_on_competitor": true,
    "competitor_urls": [
      "https://dpdpa.com/dpdpa-faq.html"
    ],
    "asked_on_saralprivacy": false,
    "saralprivacy_surfaces": [],
    "primary_citation": "DPDPA 2023 Section 16",
    "gap": "they_ask_we_dont",
    "publication_eligible": false
  },
  {
    "question_id": "QST-450396",
    "question_text": "How do cross-border data transfer rules differ between GDPR and DPDPA?",
    "audience": [
      "student"
    ],
    "topic": "Cross-border transfer",
    "dpdpa_section": null,
    "dpdp_rule": null,
    "asked_on_competitor": true,
    "competitor_urls": [
      "https://www.dpdpa.com/dpdpa-interview-questions.html"
    ],
    "asked_on_saralprivacy": false,
    "saralprivacy_surfaces": [],
    "primary_citation": "DPDPA 2023 Section 16",
    "gap": "they_ask_we_dont",
    "publication_eligible": false
  },
  {
    "question_id": "QST-488538",
    "question_text": "What is a Data Protection Impact Assessment (DPIA)?",
    "audience": [
      "business"
    ],
    "topic": "DPIA",
    "dpdpa_section": null,
    "dpdp_rule": null,
    "asked_on_competitor": true,
    "competitor_urls": [
      "https://dpdpa.com/dpdpa-faq.html"
    ],
    "asked_on_saralprivacy": false,
    "saralprivacy_surfaces": [],
    "primary_citation": "DPDPA 2023 Section 10",
    "gap": "they_ask_we_dont",
    "publication_eligible": false
  },
  {
    "question_id": "QST-885254",
    "question_text": "What is a Data Protection Impact Assessment (DPIA) and when is it required?",
    "audience": [
      "student"
    ],
    "topic": "DPIA",
    "dpdpa_section": null,
    "dpdp_rule": null,
    "asked_on_competitor": true,
    "competitor_urls": [
      "https://www.dpdpa.com/dpdpa-interview-questions.html"
    ],
    "asked_on_saralprivacy": false,
    "saralprivacy_surfaces": [],
    "primary_citation": "DPDPA 2023 Section 10",
    "gap": "they_ask_we_dont",
    "publication_eligible": false
  },
  {
    "question_id": "QST-120407",
    "question_text": "What security safeguards are required?",
    "audience": [
      "business"
    ],
    "topic": "Data Fiduciary obligations",
    "dpdpa_section": null,
    "dpdp_rule": null,
    "asked_on_competitor": true,
    "competitor_urls": [
      "https://dpdpa.com/dpdpa-faq.html"
    ],
    "asked_on_saralprivacy": false,
    "saralprivacy_surfaces": [],
    "primary_citation": "DPDPA 2023 Section 8",
    "gap": "they_ask_we_dont",
    "publication_eligible": false
  },
  {
    "question_id": "QST-127039",
    "question_text": "What is a Significant Data Fiduciary (SDF)?",
    "audience": [
      "student",
      "privacy professional"
    ],
    "topic": "Data Fiduciary obligations",
    "dpdpa_section": null,
    "dpdp_rule": null,
    "asked_on_competitor": true,
    "competitor_urls": [
      "https://www.dpdpa.com/dpdpa-interview-questions.html",
      "https://dpdpa.com/dpdpa-faq.html"
    ],
    "asked_on_saralprivacy": false,
    "saralprivacy_surfaces": [],
    "primary_citation": "DPDPA 2023 Section 8",
    "gap": "they_ask_we_dont",
    "publication_eligible": false
  },
  {